seq,type,company,field,title,link,context,time
"2651271955_1","未来十年决定成败的根本因素是什么？ | 红杉Library","http://mp.weixin.qq.com/s?__biz=MzAwODE5NDg3NQ==&mid=2651271955&idx=1&sn=eda7a2545f37d39565f8d6ed869039c3&chksm=80810d47b7f68451862a7d2d677c54871bc965f11c2d366c82774d93f0da1851aa4cd5946324#rd","近几十年来，商业环境发生了翻天覆地的变化，随着技术进步的加速，源源不断地催生出新产品和新的商业模式，企业之间的竞争也在加剧。基于此，有人开始质疑，是否战略已不再重要？事实上，战略并未消亡，各行业领域赢家和输家之间的业绩差距，随着时间的推演正在不断扩大。然而，战略制定的确需要针对当今的商业环境进行重新设计：战略分析需要考虑新的竞争维度，如构建可塑造的环境、适应不断变化的形势等；战略制定也需要考虑更广泛的时间尺度，从人工智能算法的快速发展，到气候变化等宏大命题的缓慢发展，这些问题的相关性和影响力正变得越来越大。在《动态商业战略》一书中，马丁·里维斯等借鉴波士顿咨询公司亨德森研究所多年来的研究成果，对经典战略在新商业环境下进行重新设计，有助于帮助管理者了解新的商业格局变化，以及提供如何应对这些挑战的方法。本文摘自《动态商业战略》一书，有删改。荐读之。《动态商业战略》作者：波士顿咨询公司亨德森研究所译者：孙金云出版时间：2024年3月出版社：中信出版集团“五种广义的战略视角和流程随着商业环境日益多元化，针对不同情境选择适配的战略方法和视角变得越发重要。如图8-1所示，战略有五种广义的方法和视角：1、经典：清晰的分析、规划和执行三个阶段；适用于可预测的稳定环境，比如随着GDP（国内生产总值）增长的成熟品类（像糖果、化妆品）。2、适应：重复试验并推广行之有效的视角；适用于变幻莫测的环境，其中新技术、新商业模式推动着日新月异的产品和需求模式。3、愿景：运用想象力创造出一个具有颠覆性影响的产品、服务或商业模式，然后坚持不懈地创造和发展一个新市场；当一家企业能够对环境产生重大影响而不仅仅是被动地适应环境时，愿景便是举足轻重的。4、塑造：在同时具有不可预测性和可塑性的环境中进行协作，要求企业利用生态系统和平台。5、重建：在公司战略与环境长期不匹配、时间和资源有限无法进行分析和深思熟虑的情况下，需要采取必要而激进的行动。对上述五种方法和视角中的每一种，我们都可以定义一个与之匹配的战略流程。■经典视角：规划经典视角的精髓在于制订并实施一个稳定不变的行动计划，该计划在环境相对可预测时最为有效。因此，该战略流程的要务就是创建一个切实可行的计划。高层管理团队通常要制定最初的方向或愿景，随后业务部门会进行各种类型的分析，如市场建模（预测品类增长和未来份额）和详细的财务预测。这一过程需要一些时日，因为必须对各种想法进行分析验证和整合，最后由管理层做出决策。我们可以用字母v来表示这一规划过程。具体来说，从v的左上角开始，管理层将初始目标下达给业务部门（到达v的底部），业务部门再将详细的计划反馈给公司，最终由公司敲定计划。■适应视角：试验在相对难以预测的环境中，集中的周期性规划毫无意义。相反，此时战略视角要求迅速试验和适应，从而利用那个变幻莫测的环境。简言之，这一战略流程就是在不断的试验中完善。适应性战略在测试和选拔优胜者的短周期试验中效果最佳。这一过程的关键要素包括：收集和读取信号以发现商机的能力；企业内部数据的自由流动，使团队能在几乎没有中心化管控的情况下识别机会；能够随时终止失败、成功扩大规模和组织机制。这个过程可以用字母o来表示，代表这种快速迭代的“测试—发现商机”循环。■愿景视角：想象当市场对某一特定公司具有可塑性时，愿景视角即可大显身手。由此，公司就可以围绕一个具有变革性的产品打造或塑造一个市场，而不是简单地应对既有环境。在这种情况下，战略流程的任务就是激发想象力，聚焦于有前景的产品、服务或商业模式，然后坚持不懈地将其推向市场。想象力在迭代循环中发挥作用的机制是，从一个起点开始——通常是一个愿望，或是某种需求未能得到满足的痛点，然后将其阐述成一个可实现的提案或模型。这可以用字母q来表示，圆形部分代表公司内的想象力迭代，而一旦创造出具有前景的产品，就必须将其推向市场，就像q的尾部。■塑造视角：协作当一个环境既有可塑性但又难以预测时，这就意味着对长期愿景做出努力是不明智的，此时基于生态系统或基于平台的视角才是适配的。这里的战略流程就是支持有效合作，从而塑造一个不可预测的环境，使之对公司及其利益相关者有利。我们可以用大写字母O来表示这一过程。与适应性战略的试验过程（用小写字母o表示）一样，协作过程也包含了测试、学习和发展公司理念与策略的循环。然而，大写字母O的规模更大，表明该流程涵盖了公司范围以外的参与者。■重建视角：务实当公司战略与环境长期不匹配、公司的生存能力受到威胁时，就需要立即采取纠正措施。在这种情况下，战略流程的任务就是促进快速干预，这意味着在压力下做出务实的选择，找到那条重返增长的道路。我们可以用字母I来表示这一过程，即表示自上而下的快速决策，以确保企业生存。“五项新环境下的竞争主题今天的商业领袖正在处理短期内复杂的竞争问题，但他们还必须超越当下的局势，更深入地理解什么是未来十年决定成败的根本因素。我们认为，以下五个主题将成为新竞争环境下众多企业关注的焦点（见图10-1）：■学习速度的竞争在商业领域，终身学习素来重要。但在传统的学习模式中，重要的知识是静态且持久的，比如学习如何更高效地生产某种产品或执行某个流程。未来则需要开发组织的能力进行动态学习，即学习如何做出新生事物，以及利用新技术掌握学习的方法。如今，人工智能、传感器和数字化平台已经大大增加了学习的机会，但在21世纪20年代，学习速度的竞争将至关重要。因此，企业将越来越频繁地使用人工智能并扩大其使用范围，这些优势将产生“滚雪球”效应，企业学习速度越快，越能提供更好的产品、吸引更多的客户、积累更多的数据，从而进一步增强其学习的能力。若想在学习速度的竞争中取得成功，不仅仅是需要将人工智能应用到现有的流程和结构中，企业还需要：● 将数字化纳入日常议程，囊括所有与学习相关的技术模式，包括传感器、平台、算法、数据和自动决策。● 将它们连接并整合在学习架构中，能够以数据发展式的速度学习，而不是受制于较慢的科层式决策。● 开发新的业务模式，能够创建动态的个性化客户洞察，并据此行动。■生态系统的竞争经典的竞争模型假设由不同的独立公司生产类似的产品，并在边界明晰的行业内竞争。但是，技术已经大大降低了沟通和交易成本，这使得商业环境越来越具有可塑性。企业目前已有机会影响市场的发展以谋求自身的利益，但他们只能通过与其他利益相关者协作才能达成。在上述力量的推动下，基于生态系统协作的新型产业架构正在兴起，该生态系统是由若干公司构成的、复杂的半流动网络。生态系统模糊了企业的边界，例如，优步和来福车（Lyft）等平台企业在很大程度上依赖“零工经济”的劳动者，他们不是直接雇用员工，而是成为大量临时自由职业者的聚合平台。生态系统还模糊了行业界限：例如，汽车生态系统不仅包括传统供应商，还包括网络连接、软件和云存储供应商。生态系统还模糊了合作者与竞争者的区别，例如，亚马逊虽然与第三方商家是共生关系，但它也通过销售自有品牌与这些商家竞争。企业如何打造生态系统的总体范式尚未成熟，但以下几个关键因素正变得越来越明晰：● 采用完全不同的战略视角，遵循外部导向、一致化的平台、协同演化、涌现和间接货币化等可接受的原则。● 明确公司在一个或多个生态系统中可能扮演的角色，并认识到不是所有公司都能成为协调者。● 确保公司不仅为自己，而且为整个生态系统创造价值。■现实世界与数字世界的双重竞争当下最具价值、增长最快的企业多为年轻的科技公司，它们运营的生态系统大多是数字化的（见图10-3）。随着人工智能和物联网的快速发展和渗透，新机遇可能越来越多地来自现实世界的数字化。这将频繁推动科技公司进入那些仍由老牌公司主导的领域。现实世界与数字世界交点处的“混合”竞争已初露端倪。数字“巨头”正在进军实体行业，老牌企业也在大力推进数字化。未来商业的“自然选择”浪潮将同时考验数字原住民和传统企业，任何一方都有可能成为赢家。那么要想在混合竞争中取得成功，哪些因素具有决定性呢？企业需要做到：● 与生态系统双边的参与者，即客户和供应商，建立牢固的关系；● 重新思考现有的商业模式，以赢得新的混合市场；● 采用有效的数据和算法管理，强化客户信任。■想象力的竞争依赖现有商业模式取得成功已难以为继。市场的可塑性越来越强，增加了创新的潜在回报。因此，产生新想法的能力比以往任何时候都更为重要。然而，对许多企业而言，产生新创意是极具挑战性的。随着企业年龄和规模的增长，惰性也随之增强，更加不易产生创造性的新想法：历史越悠久、规模越大的公司，活力就越弱，普遍缺少可持续发展和重塑的能力（见图10-4）。若要克服上述挑战，企业需要在想象力方面大做文章。企业如何在想象力方面展开竞争？● 专注于异常情况、偶然事件和类比推理，而不是常规事件，以激发灵感。● 促进思想的公开传播和竞争，例如弱化等级制度，授权员工进行实验和提出富有想象力的建议。● 成为一家“会玩的公司”，能够游刃有余地探索新的可能性。■复原力的竞争世界的方方面面都在快速变化。在如此背景下，预测和规划可能成为纸上谈兵。商业领袖需要考虑更广阔的视角，确保企业能承受意料之外的冲击且经久不衰。换言之，企业需要在复原力方面进行有效竞争。创建复原能力往往与效率、短期财务最大化等传统管理目标相悖。但是，要想在不断变化的环境中持续健康成长，企业必须将复原力明确列为优先事项。企业可从以下几点着手：● 为各种情景做好准备，确保战略稳健、风险可承受。● 建立一个能够迅速响应新情境的适应性组织，例如，通过持续实验来确定新的选择。● 积极参与集体行动，应对全球经济和社会面临的重大问题，以维持经营的社会合法性。互动送好礼文中提到的新竞争环境下的5个主题，你最关注哪个？为什么？欢迎留下你的想法和思考，我们将从中选出6位读者，送出《动态商业战略》一本！注：时间截至4月12日24:00，获奖用户请于收到通知后24小时内回复邮寄信息，未收到通知或未及时回复则视为“谢谢参与”。推荐阅读壹在成为“增长机器”之前，你首先需要成为学习机器 | 红杉汇内参贰报名开启：要么成功，要么成长 | 耶鲁-红杉领导力中心五期叁杰出领导者的“根本之事” | 首席人才官肆人形机器人的昨天、今天与明天 | 红杉爱科学伍如何成为数字时代领导者？| 红杉Library","2024-04-10 22:16:57"
